Product Name,Description,Price (#)
Organic Quinoa (500g),"High-protein, gluten-free grain perfect for salads, bowls, and meal prep.",3500
Mixed Dried Fruit Pack (250g),"A sweet and healthy snack mix of dates, raisins, apricots, and coconut flakes.",2800
Oat & Chia Breakfast Cereal (1kg),"Fiber-rich, heart-healthy blend for a nutritious morning meal.",4200
Cold-Pressed Avocado Oil (250ml),Healthy alternative to regular oil — great for cooking and salad dressing.,5000
Herbal Detox Green Tea (20 bags),"A soothing blend of green tea, lemongrass, and mint to support digestion.",1900
